<?xml version="1.0" encoding="UTF-8"?>
<xs:schema xmlns:xs="http://www.w3.org/2001/XMLSchema">
    <xs:element name="Library">
        <xs:complexType>
            <xs:sequence>
                <xs:element name="location" type="xs:string" />
                <xs:element name="description" type="xs:string" />
                <xs:element name="librarian" type="xs:string" />
                <xs:element name="book">
                    <xs:complexType>
                        <xs:sequence>
                            <xs:element name="title" type="xs:string" />
                            <xs:element name="ISBN" type="xs:string" minOccurs="0" />
                            <xs:element name="Author" type="xs:string" />
                            <xs:element name="preface" type="xs:string" minOccurs="0" />
                            <xs:element name="part">
                                <xs:complexType>
                                    <xs:sequence>
                                        <xs:element name="title">
                                            <xs:complexType>
                                                <xs:sequence>
                                                    <xs:element name="chapter">
                                                        <xs:complexType>
                                                            <xs:sequence>
                                                                <xs:element name="title"
                                                                    type="xs:string" />
                                                                <xs:element name="summary"
                                                                    type="xs:string" />
                                                                <xs:element name="section">
                                                                    <xs:complexType>
                                                                        <xs:sequence>
                                                                            <xs:element
                                                                                name="content">
                                                                                <xs:complexType>
                                                                                    <xs:sequence>
                                                                                        <xs:element
                                                                                            name="paragraph"
                                                                                            type="xs:string" />
                                                                                    </xs:sequence>
                                                                                </xs:complexType>
                                                                            </xs:element>
                                                                        </xs:sequence>
                                                                    </xs:complexType>
                                                                </xs:element>
                                                            </xs:sequence>
                                                            <xs:attribute name="chapter"
                                                                type="xs:string" />
                                                        </xs:complexType>
                                                    </xs:element>
                                                </xs:sequence>
                                            </xs:complexType>
                                        </xs:element>
                                    </xs:sequence>
                                </xs:complexType>
                            </xs:element>
                        </xs:sequence>
                        <xs:attribute name="language" type="xs:string" use="required" />
                    </xs:complexType>
                </xs:element>
            </xs:sequence>
        </xs:complexType>
    </xs:element>
</xs:schema>